제목,기사 내용,타임스탬프
"남양주시, 안심 존(Safe Zone) 확대 구축","▲ 남양주시청 전경 (C)브레이크뉴스 하인규 기자



(남양주=브레이크뉴스 경기동북부)하인규 기자=남양주시(시장 주광덕)는 여성·아동이 안심하고 생활할 수 있는 안전 도시를 조성하기 위한 방범용 CCTV 추가 설치 및 안전귀가 서비스를 추진해 ‘안심 존(Safe Zone)’을 확대 구축한다고 22일 밝혔다.

시는 올해도 △범죄 취약 지역 △어린이 보호구역 △놀이터 △다수 밀집지역 등 총 55개소에 방범용 CCTV를 신규 설치하고, 방범용 CCTV 안내판과 비상벨·노후 CCTV를 전면 교체하는 등 30개소의 카메라 80대에 대한 성능 개선 사업을 추진할 예정이다.

또한, 오는 5월부터는 시 전역 1,746개소에 설치된 5,668대의 CCTV와 스마트폰 앱을 활용해 여성과 학생 등 사회적 약자의 안전한 귀가를 돕는 ‘안전귀가 서비스’를 시작할 계획이다.

안전귀가 서비스는 스마트폰 앱을 설치한 사용자가 늦은 밤 귀가 중이거나위험한 상황에 직면했을 때 스마트폰을 흔들거나 SOS버튼을 누르면 사용자 위치가 CCTV관제센터와 지정된 보호자에게 자동으로 전송되는 서비스이다.

시 관계자는 “방범용 CCTV를 확충하고, 지속적인 관리를 통해 여성과 어린이를 위한 안심 존을 확대해 나가겠다.”라며 “앞으로도 여성과 어린이를 대상으로 한 범죄의 사각지대를 해소하고, 시민 모두가 안심하고 생활할 수 있는 안전 도시를 만들 수 있도록 노력하겠다.”라고 전했다.

한편, 방범용 CCTV 설치사업과 안전귀가 서비스는 민선 8기 복지 분야 공약사업인‘여성안전도시 환경구축’의 일환으로, 여성·아동을 대상으로 한 범죄의 사각지대를 최소화하고 더불어 안전귀가 서비스의 실시로 범죄 예방 효과를 극대화하기 위해 추진되고 있다.

하인규 기자 popupnews24@naver.com

아래는 위의 글을 구글번역이 번역한 영문의 전문이다. '구글번역'은 이해도를 높이기를 위해 노력하고 있습니다. 영문 번역에 오류가 있을 수 있음을 전제로 합니다.Below is the full text of the above article translated into English by Google Translate. ‘Google Translate’ is working to improve understanding. It is assumed that there may be errors in the English translation.

Namyangju City expands and establishes Safe Zone

By installing CCTV for crime prevention and establishing a ‘safe return service’, we are creating a ‘safe city where women and children can live in peace’.

-Reporter Ha In-gyu

(Namyangju = Break News Northeastern Gyeonggi) Namyangju City (Mayor Joo Gwang-deok) is promoting the installation of additional CCTV for crime prevention and safe return service to create a safe city where women and children can live in peace, creating a ‘Safe Zone’. It was announced on the 22nd that expansion would be implemented.

This year, the city installed new crime prevention CCTVs in a total of 55 locations, including △ crime-vulnerable areas △ children's protection zones △ playgrounds △ high-density areas, and completely replaced crime prevention CCTV signboards, emergency bells, and old CCTVs, and installed cameras at 30 locations. We plan to pursue a performance improvement project for people in their 80s.

In addition, starting in May, we plan to launch a ‘Safe Return Service’ to help the socially disadvantaged, such as women and students, return home safely using 5,668 CCTVs and smartphone apps installed in 1,746 locations across the city.

The safe return service is a service that automatically transmits the user's location to the CCTV control center and the designated guardian when a user who has installed the smartphone app shakes the smartphone or presses the SOS button when returning home late at night or when faced with a dangerous situation.

A city official said, “We will expand CCTV for crime prevention and expand safe zones for women and children through continuous management.” He added, “We will continue to eliminate blind spots in crimes against women and children and ensure that all citizens feel safe.” “We will strive to create a safe city where people can live and work.”

Meanwhile, the CCTV installation project for crime prevention and the safe return service are part of the 8th popularly elected welfare sector pledge project, 'Establishment of a safe city environment for women', to minimize blind spots for crimes targeting women and children and to provide the safe return service. This is being implemented to maximize the crime prevention effect.

원본 기사 보기: 브레이크뉴스 경기동북부",2024-02-12 01:17:18
"서초구,비상벨표준안 마련… 위급상황때 찾기 쉽게 제작","이재명 더불어민주당 대표가 설날인 10일 자정을 전후해 X(옛 트위터) 계정에 연이어 글을 올렸다. 단합을 강조하면서 설 연휴에 적극적으로 민주당에 유리한 여론 조성을 해 달라고 독려했다. 이 대표는 지난 9일 밤 11시 57분 ‘단결만이 답입니다’라는 글을 X 계정에 올렸다. 그는 ""설을 앞둔 밤이 깊어가는 만큼 저와 우리 진영에 주어진 소명의 무게를 되새긴다""며 ""소명을 다하는 일은 결코 쉽지 않다. 계파를 가르고 출신을 따질 여유가 없다""고 밝혔다. 특히 ""친명, 비명 나누는 것은 소명을 외면하는 죄악""이라고 했다.이 대표는 9분 뒤인 10일 오전 0시 6분 ""새해 복 많이 만들어요""라며 다시 글을 게재했다. 그는 ""힘드십니까? 행동하면 바뀝니다""라며 ""약하십니까? 바다도 물방울이 모인 것입니다""라고 말했다. 이어 ""RT 한번, 댓글 한 개, 카톡 한 번이 세상을 바꾼다""고 했다. 이 대표의 글은 오전 0시 15분에도 다시 올라왔다. 그는 ""어떤 역사적 대사건도 결국 한 사람으로부터 시작됐다""고 밝혔다. 6분 뒤에는 ""이번 총선이 대한민국의 운명과 우리의 미래를 결정한다""며 ""흥망과 성쇄, 퇴행과 진보의 갈림길에서 무관심과 방관은 죄악""이라고 거듭 주장했다. ‘성쇄’는 ‘성쇠(盛衰)’의 오기로 보인다같은 날 오전 0시 39분에는 당 영입 인재 2호 이재성 전 엔씨소프트 전무를 두고 ""부산에 출마하는 이재성 후보, 업어드리고 싶다""고 했다. 이 전 전무는 부산 사하을에 출사표를 던졌다.이 대표는 설날 아침 페이스북에 또 글을 올렸다. ""올해 설 명절은 유독 그 의미가 남다르다""며 어린 시절 부모님과 함께 찍은 가족사진을 공개했다. 이어 ""생사의 문턱을 잠시 헤매었기 때문일까. 가족들과 함께 보낼 수 있는 명절이 얼마나 큰 행복인지 절감한다""며 ""살아야겠다는 의지가 샘솟았던 건 고백하자면 순전히 우리 가족들에 대한 미안함, 고맙다는 말을 미처 다 하지 못했다는 아찔함 때문이었다""고 했다.조성진 기",2024-02-12 01:17:20
"인천 미추홀구, '수인선 달맞이 조경사업' 완료","인천 미추홀구(구청장 이영훈)는 22일 수인선 바람길 숲에 야간경관 개선을 위한 ‘수인선 달맞이 조경사업’을 완료했다고 밝혔다.

2021년 숭의역~인하대역 상부 1.5km 구간에 조성된 수인선 바람길 숲은 주간에는 관광 명소로 많은 사랑을 받고 있지만, 야간에는 특색있는 볼거리가 없다는 문제점이 제기됐었다.

구는 문제점을 개선하기 위해 인천시 주민참여예산사업을 통해 시비 9억 원을 확보, 야간에도 주민들이 안전하게 즐길 수 있도록 다양한 시설물을 설치했다.

바람길 숲에는 옛 수인선 철로 길의 추억을 살릴 수 있도록 보름달 포토 존, 토끼, 목제전봇대 등 특화 조형물과 쉼터 조명, 수목 투광등, 조명 벽화 등 야간경관시설이 조성됐으며, 이용객 안전을 위한 CCTV, 방송시설, 비상벨 등도 설치됐다.

또한, 수인선 바람길 숲 대표 수종인 메타세쿼이아 숲길 아래에는 꽃복숭아 250주를 심어 붉게 물든 꽃길을 조성했다.

구 관계자는 “주민들이 야간에도 산책로를 거닐며 색다른 즐거움을 느낄 수 있길 바란다.”라며, “앞으로도 지속해서 시설개선과 함께 유지관리에 힘써 구민들의 녹색 복지 증진에 최선을 다할 계획이다.”라고 전했다.

한편, 수인선 바람길 숲은 조성 및 관리에 우수한 성과를 보여 2021년 산림청 전국녹색도시 최우수상 수상, 행정안전부 지방규제혁신 우수기관 선정, 2023년 한국일보 대한민국 서비스 만족 대상 수상, 산림청 모범 도시 숲 인증에 선정된 바 있다.",2024-02-12 01:17:21
"남양주시, 방범용 CCTV 설치 등 '여성·어린이 안심 존(Safe Zone)'확대","경기 남양주시는 여성·아동이 안심하고 생활할 수 있는 안전 도시를 조성하기 위한 방범용 CCTV 추가 설치 및 안전귀가 서비스를 추진해 ‘안심 존(Safe Zone)’을 확대 구축한다고 22일 밝혔다.

ⓒ남양주시 제공

시는 올해도 △범죄 취약 지역 △어린이 보호구역 △놀이터 △다수 밀집지역 등 총 55개소에 방범용 CCTV를 신규 설치하고, 방범용 CCTV 안내판과 비상벨·노후 CCTV를 전면 교체하는 등 30개소의 카메라 80대에 대한 성능 개선 사업을 추진할 예정이다.





또한, 오는 5월부터는 시 전역 1746개소에 설치된 5668대의 CCTV와 스마트폰 앱을 활용해 여성과 학생 등 사회적 약자의 안전한 귀가를 돕는 ‘안전귀가 서비스’를 시작할 계획이다.





안전귀가 서비스는 스마트폰 앱을 설치한 사용자가 늦은 밤 귀가 중이거나 위험한 상황에 직면했을 때 스마트폰을 흔들거나 SOS버튼을 누르면 사용자 위치가 CCTV관제센터와 지정된 보호자에게 자동으로 전송되는 서비스이다.





시 관계자는 “방범용 CCTV를 확충하고, 지속적인 관리를 통해 여성과 어린이를 위한 안심 존을 확대해 나가겠다”며 “앞으로도 여성과 어린이를 대상으로 한 범죄의 사각지대를 해소하고, 시민 모두가 안심하고 생활할 수 있는 안전 도시를 만들 수 있도록 노력하겠다”고 전했다.",2024-02-12 01:17:23
"서초형비상벨, 찾기 쉬운 '서초형비상벨'로 범죄 예방","‘서초형 비상벨 디자인 표준안’ - 기본형 - ‘서초형 비상벨 디자인 표준안’ - 축소형(공중화장실 등 협소공간) -

서울 서초구(구청장 전성수)가 올해부터 구에서 관리하는 공중화장실, 공영주차장, 폐쇄회로TV(CCTV) 등 설치된 비상벨에 ‘서초형 비상벨 디자인 표준안’을 적용한다고 밝혔다.

그간 다양한 공공장소에 설치된 비상벨의 디자인이 제각기 달라 위급상황시 비상벨의 위치를 쉽게 알아차리지 못하는 어려움이 있었다. 이에 구는 범죄 등 각 종 긴급상황에 비상벨을 쉽고 빠르게 찾을 수 있도록 통일된 ‘서초형 비상벨 디자인 표준안’을 마련하여 그 사용성을 크게 높인 것이다.

현재 공중화장실, 공영주차장, CCTV 등 구가 관리하는 공공시설에 설치된 비상벨은 전체 1889개이며 순차적으로 이번 디자인 표준안으로 바꿔나갈 계획이다.

이번 서초구 비상벨 디자인의 특징을 보면, 먼저 기존에 서울시에서 마련한 CCTV 표준디자인과 크게 다르지 않도록 일체감 있게 만들어 주민들이 혼란스럽지 않게 하였고, 비상벨 상단의 안내판 부분은 안전을 상징하는 노란색으로, 벨 부분은 밤에도 쉽게 인지할 수 있도록 빨간색으로 제작하여 위급상황시 시인성을 높였다는 점이다.

한편 구는, 비상벨 외에도 로고젝터, 폴리스팟, 순찰표지판 등 범죄예방시설물 112대를 함께 운영하고 있다. 이들 비상벨 및 범죄예방시설물에 대해 주기적인 점검과 정비를 상시 진행하고 있으며, 최근에는 일제점검을 통해 비상벨 144개, 로고젝터 및 순찰표지판 등 시설물 26대 정비를 완료하는 등 시설물 관리도 철저하게 실시하고 있다.

전성수 서초구청장은 “이번 범죄예방시설물의 표준디자인 제작 및 적용을 통해 범죄로부터 더욱 안전한 서초를 만들기 위해 최선을 다하겠다”라고 말했다.",2024-02-12 01:17:24
서울 가로등 100% LED로 전환...디밍·지능형 점소등 등 첨단기술로 무장,"내년까지 시도 상 가로등 전면 교체‧스마트 밝기제어 도입



기상상황 등에 따라 가로등 자동제어, 실시간 원격점검도



‘한강교량’에 특화조명 설치 야경개선, 올해 원효‧가양대교 대상

서울시의 노후 가로등 개량 전과 후의 도로 전경/제공=서울시

서울시가 내년까지 모든 가로등을 LED조명으로 교체하고, 시간대나 기상 상황에 맞춰 가로등을 켜고 끄는 ‘지능형 점·소등 시스템’을 도입한다. 또 가로등과 비상벨․무선인터넷(WIFI)․도시데이터센서 등을 융합한 편리한 스마트도시 서비스 시설물을 도입하고, ‘한강 교량’에는 서울의 매력을 다채로운 색상으로 표현할 수 있는 야간 경관조명도 설치한다.

서울시는 안전하고 쾌적한 도로 환경과 아름다운 도시경관을 만들기 위해 올해 가로등을 비롯한 ‘도로조명 시설 개선’에 본격 착수한다고 밝혔다. 시는 노후 가로등 개량 180억원을 포함해 올해 총 215억 원의 예산을 투입할 방침이며, 이중에는 노후 가로등 개량 외에 ▲가로등 스마트 밝기 조절(디밍 시스템)에 5억원 ▲가로등 원격점검 시스템 구축에 9억원 ▲경관조명 시설 개선에 21억원이 각각 투입된다.

▲서울 가로등, 전통조명 퇴출...전량 LED로

구체적으로 서울시는 일반 시도(市道), 자동차전용도로, 교량과 고가차도 등에 설치된 15년 넘은 노후 가로등과 조명시설을 전면 개량키로 했다.

이는 시설 노후로 발생할 수 있는 누전 등 전기안전사고를 예방하고, 야간 도로 운전자에게 밝고 안전한 주행환경을 제공하기 위한 것으로, 올해 중으로 ▲가로등 3475등 ▲가로등주 2185본 ▲전선로 65km ▲분전함 303면을 교체할 계획이다.

서울시는 지난해 작년 말까지 시도에 설치된 가로등 14만2822등 중에 92.3%(13만1826등)를 LED로 교체, 전기요금 연 54억원과 온실가스 2만4652 tCO2(이산화탄소톤)을 줄인 바 있다면서 올해는 잔여분 중 3475등을 교체할 계획이라고 밝혔다.

또 교통량이 줄어드는 야간에 가로등 밝기를 자동으로 조절하는 스마트 밝기 제어장치(디밍)도 본격 도입된다.

서울시는 지난 2014년부터 중구 무교로 등 14개 노선 가로등 3977본에 디밍 제어장치를 설치, 연간 20~30%의 전력량을 추가로 절감하고 있다. 올해는 강남구 일대에 588본을 설치할 예정이다.

서울시의 가로등 점소등 시스템 개선도/제공=서울시

▲기상상황 등 따라 자동 제어되는 ‘지능형 점‧소등 시스템’, 실시간 원격점검도 도입>

일출·일몰, 기상상황 등을 고려해 수동으로 제어했던 가로등 점·소등 방식이 앞으로는 날씨와 교통정보를 연계한 지능형시스템으로 전환된다. 또 가로등 고장을 실시간으로 확인할 수 있는 ‘원격점검 시스템’도 구축된다. 서울시는 올해 중으로 누전 등 기기 이상 유무를 실시간으로 확인할 수 있는 원격점검장치를 시도(市道) 상 가로등 분전함(총 4540개소)에 설치를 예정이다. 한국전기안전공사와 협력해 이뤄지는 ‘실시간 원격점검’이 이뤄지면 가로등 이상 여부를 즉각 확인·조치할 수 있어 안전사고를 사전에 예방할 수 있을 것으로 기대된다. \

특히 서울시는 가로등에 각종 시설물을 융합해 편리하고 다양한 스마트도시 서비스를 제공하고 야간경관에 재미를 주는 펀(Fun) 디자인도 적용한다.

도시정보를 수집·제공하고 시민 안전도 높이기 위해 가로등에 ▲CCTV ▲비상벨 ▲무선 인터넷(WIFI)과 함께 사물인터넷을 기반으로 소음·미세먼지 등 17종의 도시환경 정보를 수집하는 도시데이터센서(S-DoT)도 통합 설치한다.

서울시는 가로등주와 신호등, 보행안내표지판과 가로등 분전함을 통합하는 한편 분전함 일체형 가로등주를 확대해 미관뿐 아니라 보행환경도 개선할 예정이라며 또 가로등에 재미있는(FUN) 디자인 요소를 더해 밝고 안전한 거리를 조성할 방침이라고 밝혔다. 현재 서울 시내에는 가로등주와 사인물 통합 분전함 605면, 가로등과 신호등 통합주 1,170본이 설치돼 운영 중이다.

야경이 아름다운 매력 도시 ‘서울’을 만들어 내는 데 필수라 할 수 있는 ‘한강 교량’ 경관조명도 개선된다.

단기적으로는 거점 교량을 선정, 특화된 조명을 비롯한 아름다운 한강 야경을 조성하고 중장기적으로는 모든 한강 교량 경관조명을 통합 연출할 계획도 마련된다.

서울시는 이를 위해 한강 교량의 오래된 경관조명 시설을 연차별로 개량키로 하고 올해는 조명시설이 노후한 원효대교, 가양대교의 단색 경관조명을 에너지 효율이 높으면서도 다채로운 색으로 연출할 수 있는 LED 조명으로 교체할 예정이다.

두 교량의 조명시설은 모두 2002년에 설치돼 노후할 뿐만 아니라 당시에는 LED조명을 적용하지 않아 에너지 효율이 낮고 유지관리가 어려운 실정이다.

서울시는 또 시내 ‘야간경관 축’을 고려해 지역․노선별 가로등의 광원 색온도를 다르게 설치, 각 지점에 어울리는 색상과 밝기로 조성 중이다.

‘도로조명 색온도 기준’에 따라 ▲광로·대로는 4000~5000K ▲중로 3500~5000K ▲소로 3000~4000K ▲사대문 내 3000~3500K ▲한강변 2700~3000K로 구분해 서울 시내 야경을 연출한다.

김성보 서울시 재난안전관리실장은 “야간조명은 ‘안전’뿐만 아니라 도시의 매력을 좌우하는 중요한 요소인 만큼 시민 삶의 질과 관광 경쟁력을 높이기 위해 조화롭게 개선해 나가야 한다”며 “다양한 조명시설이 잘 어우러져 서울을 더 안전하고 아름답게 밝힐 수 있도록 체계적으로 개선해 나갈 것”이라고 말했다.",2024-02-12 01:17:25
"보령시, 경찰과 합동 안심비상벨특별 전수점검","비상벨 점검. 사진=보령시

(보령=국제뉴스) 김석태 기자 = 보령시는 시민이 안심할 수 있는 보행환경 조성 및 신뢰성 높은 안전시설물 관리를 위해 지난 15일부터 일주일 동안 보령경찰서와 합동으로 보령지역 설치 방범용 비상벨에 대한 특별 전수점검에 나섰다.

점검은 ▲비상벨 외관 상태 및 작동 여부 ▲관제센터와의 연계 및 통화 상태 ▲안내판 시인성 점검 ▲주변 적치물 상황 등의 사항을 중점으로 진행됐다.

점검을 통해 발견된 장애는 비상벨의 기능이 정상화될 수 있도록 즉시 보수 및 장비교체를 실시할 계획이다.

비상벨은 사회적 약자들을 보호하기 위해 인구밀집지역, 범죄취약지역, 어린이보호구역, 공원, 산책로 등 160곳에 설치돼 있다.

위급상황 발생 시 비상벨을 누르면 24시간 365일 보령시 CCTV통합관제센터에서 근무하는 관제요원과 실시간 대화가 가능하며 위급상황에 따라 대화자의 상태를 확인 긴급조치(경찰 및 응급차량 출동지원)를 할 수 있는 시스템이다.",2024-02-12 01:17:26
"보령시-보령경찰서, 안심비상벨특별 전수점검","보령시 전역에 설치되어 있는 방범용 비상벨에 대한 특별 전수 점검중인 보령시와 보령경찰서, 김호 안전총괄과장이 비상벨을 살펴 보고 있다.

〔중부매일 서성원 기자〕보령시는 시민이 안심할 수 있는 보행환경 조성 및 신뢰성 높은 안전시설물 관리를 위해 지난 15일부터 일주일 동안 보령시와 보령경찰서 합동으로 보령시 전역에 설치되어 있는 방범용 비상벨에 대한 특별 전수 점검에 나섰다.



점검은 ▷비상벨 외관 상태 및 작동 여부 ▷관제센터와의 연계 및 통화 상태 ▷안내판 시인성 점검 ▷주변 적치물 상황 등의 사항을 중점으로 진행된다.



이번 점검을 통해 발견된 장애는 비상벨의 기능이 정상화될 수 있도록 즉시 보수 및 장비교체를 실시할 계획이다.



비상벨은 사회적 약자들을 보호하기 위해 인구밀집지역, 범죄취약지역, 어린이보호구역, 공원, 산책로 등 160곳에 설치되어 있다.



위급상황 발생 시 비상벨을 누르면 24시간 365일 보령시 CCTV통합관제센터에서 근무하는 관제요원과 실시간 대화가 가능하며, 위급상황에 따라 대화자의 상태를 확인하여 긴급조치(경찰 및 응급차량 출동지원)를 할 수 있는 시스템이다.



김호 안전총괄과장은 ""비상벨과 같은 사회안전 시설물은 사후관리가 매우 중요하다""며 ""앞으로도 보령경찰서와 유기적인 협력체계를 구축하여, 안전시설물을 확충하고 기존 시설물의 철저한 점검 및 관리를 통해 시민이 안심할 수 있도록 최선을 다할 것""이라고 밝혔다.",2024-02-12 01:17:27
"충남 보령시, 보령경찰서 합동 안심비상벨전수점검","[충남=뉴스프리존]이진영 기자= 충남 보령시는 시민이 안심할 수 있는 보행환경 조성 및 신뢰성 높은 안전시설물 관리를 위해 보령경찰서와 합동으로 보령시 전역에 설치되어 있는 방범용 비상벨에 대한 특별 전수 점검에 나섰다고 22일 밝혔다.

비상벨 점검 장면.(사진= 보령시청)

점검은 ▲비상벨 외관 상태 및 작동 여부 ▲관제센터와의 연계 및 통화 상태 ▲안내판 시인성 점검 ▲주변 적치물 상황 등의 사항을 중점으로 진행된다.

이번 점검을 통해 발견된 장애는 비상벨의 기능이 정상화될 수 있도록 즉시 보수 및 장비교체를 실시할 계획이다.

비상벨은 사회적 약자들을 보호하기 위해 인구밀집지역, 범죄취약지역, 어린이보호구역, 공원, 산책로 등 160곳에 설치돼 있다.

위급상황 발생 시 비상벨을 누르면 24시간 365일 보령시 CCTV통합관제센터에서 근무하는 관제요원과 실시간 대화가 가능하며, 위급상황에 따라 대화자의 상태를 확인하여 긴급조치(경찰 및 응급차량 출동지원)를 할 수 있는 시스템이다.

김호 안전총괄과장은 “비상벨과 같은 사회안전 시설물은 사후관리가 매우 중요하다”며 “앞으로도 보령경찰서와 유기적인 협력체계를 구축해 안전시설물을 확충하고 기존 시설물의 철저한 점검 및 관리를 통해 시민이 안심할 수 있도록 최선을 다할 것”이라고 말했다.",2024-02-12 01:17:28
"보령시, 보령경찰서와 합동으로 안심비상벨전수점검","안심비상벨 합동 전수점검 장면

[충남일보 임영한 기자]충남 보령시는 지난 15일부터 일주일 동안 보령시와 보령경찰서 합동으로 보령시 전역에 설치되어 있는 방범용 비상벨에 대한 특별 전수 점검에 나섰다.

점검은 ▲비상벨 외관 상태 및 작동 여부 ▲관제센터와의 연계 및 통화 상태 ▲안내판 시인성 점검 ▲주변 적치물 상황 등의 사항을 중점으로 진행된다.

이번 점검을 통해 발견된 장애는 비상벨의 기능이 정상화될 수 있도록 즉시 보수 및 장비교체를 실시할 계획이다.

비상벨은 사회적 약자들을 보호하기 위해 인구밀집지역, 범죄취약지역, 어린이보호구역, 공원, 산책로 등 160곳에 설치되어 있다.

위급상황 발생 시 비상벨을 누르면 24시간 365일 보령시 CCTV통합관제센터에서 근무하는 관제요원과 실시간 대화가 가능하며, 위급상황에 따라 대화자의 상태를 확인하여 긴급조치(경찰 및 응급차량 출동지원)를 할 수 있는 시스템이다.

김호 안전총괄과장은“비상벨과 같은 사회안전 시설물은 사후관리가 매우 중요하다”며 “앞으로도 보령경찰서와 유기적인 협력체계를 구축하여, 안전시설물을 확충하고 기존 시설물의 철저한 점검 및 관리를 통해 시민이 안심할 수 있도록 최선을 다할 것”이라고 전했다.",2024-02-12 01:17:29
